{
  "schema_version": 1,
  "decision_request_id": "decision_license",
  "revision": 1,
  "previous_revision": null,
  "conversation_id": "chat_resume_demo",
  "task_id": "task_resume_voice_docs",
  "context_version": 7,
  "status": "pending",
  "question": "Which permissive license should govern the public project?",
  "why_user_needed": "The choice affects downstream redistribution and patent terms.",
  "options": [
    {
      "option_id": "apache_2",
      "label": "Apache-2.0",
      "description": "A permissive license with an explicit patent grant.",
      "consequences": [
        "Requires preserving notices",
        "Provides explicit patent terms"
      ]
    },
    {
      "option_id": "mit",
      "label": "MIT",
      "description": "A short permissive license widely used for software.",
      "consequences": [
        "Very simple reuse terms",
        "No explicit patent-license language"
      ]
    }
  ],
  "recommended_option_id": "apache_2",
  "recommendation_rationale": "The explicit patent grant is useful for an agent architecture intended for broad implementation.",
  "involvement_mode": "balanced",
  "requested_by": {
    "role": "controller",
    "id": "task_controller"
  },
  "resolution": null,
  "superseded_by_decision_request_id": null,
  "created_at": "2026-08-02T12:05:00Z",
  "terminal_at": null
}
